{
  "entry_id": "9b2f8e7a-4c1d-4f3a-b6e8-1a9c2d8f4b7e",
  "timestamp_utc": "2026-04-28T03:14:15.926Z",
  "client_timestamp_utc": "2026-04-28T03:14:15.901Z",
  "model_id": "claude-sonnet-4-6",
  "caller_identity": "svc-onboarding-prod-7f4a",
  "policy_version_hash": "3a7bd3e2360a3d29eea436fcfb7e44c735d117c42d1c1835420b6b9942dd4f1b",
  "human_review_flag": {
    "state": "none"
  },
  "signing_key_version": "alias/audit-log-prod-2026-q2/v3"
}
