{
  "entry_id": "c4e8d9a2-3b6f-4e1c-9a7d-5f2e8c4b1d6a",
  "timestamp_utc": "2026-04-28T03:14:16.203Z",
  "client_timestamp_utc": "2026-04-28T03:14:16.180Z",
  "model_id": "claude-sonnet-4-6",
  "caller_identity": "svc-credit-decision-prod-2c8e",
  "policy_version_hash": "3a7bd3e2360a3d29eea436fcfb7e44c735d117c42d1c1835420b6b9942dd4f1b",
  "human_review_flag": {
    "state": "attested",
    "attested_by": "reviewer-token:7f3c8b2a-9e4d-4f1a-b3c6-8e2d4a7f9c1b",
    "attestation_timestamp_utc": "2026-04-28T03:18:42.117Z",
    "attestation_justification": "Reviewed model output against current credit-decision policy v3.2 and confirmed the recommendation was consistent with documented underwriting criteria. Spot-checked supporting feature attributions; no anomalies. Approved for downstream automated decisioning step.",
    "attestation_scope": "full"
  },
  "signing_key_version": "alias/audit-log-prod-2026-q2/v3"
}
